{
  "schema": "junction.crm_student_handoff.1.0.0",
  "junctionStudentId": "crm-issued-student-001",
  "revision": 1,
  "issuedAt": "2026-09-24T10:00:00Z",
  "idempotencyKey": "crm-handoff-001-v1-arkitect",
  "source": {"system": "sales_crm", "recordId": "crm-record-001"},
  "authorization": {"grantId": "grant-001", "recipient": "arkitect", "purpose": "application_strategy", "grantedAt": "2026-09-24T09:55:00Z", "expiresAt": null},
  "student": {"name": "示例学生", "grade": "G9", "school": "示例学校", "contactPhone": "+8613800138000"},
  "assignments": [{"service": "arkitect", "assignmentId": "assignment-001", "assignmentVersion": 1, "status": "active", "effectiveAt": "2026-09-24T10:00:00Z", "assigneeRef": null}],
  "identityLinkIds": []
}
